{
  "metadata": {
    "generated_at": "2026-10-19T23:44:23+00:00",
    "seed_bootstrap": 42,
    "managed_tools": [
      "wai",
      "testaruda",
      "turu",
      "dont",
      "ah",
      "pretender",
      "vampiro",
      "incitaciones",
      "bd",
      "openspec",
      "specodelic",
      "funkalization",
      "wild"
    ],
    "fleet_definition": "repos charly-vibes con actividad en sesiones in-scope (walk pi) o interacciones en project_monthly",
    "provenance": {
      "fleet": {
        "wai": {
          "git": true,
          "gh": true,
          "sessions": 76
        },
        "testaruda": {
          "git": true,
          "gh": true,
          "sessions": 79
        },
        "turu": {
          "git": true,
          "gh": true,
          "sessions": 17
        },
        "dont": {
          "git": true,
          "gh": true,
          "sessions": 99
        },
        "ah": {
          "git": true,
          "gh": true,
          "sessions": 67
        },
        "pretender": {
          "git": true,
          "gh": true,
          "sessions": 37
        },
        "vampiro": {
          "git": true,
          "gh": true,
          "sessions": 40
        },
        "incitaciones": {
          "git": true,
          "gh": true,
          "sessions": 43
        },
        "bd": {
          "git": false,
          "gh": false,
          "sessions": 0
        },
        "openspec": {
          "git": true,
          "gh": true,
          "sessions": 0
        },
        "specodelic": {
          "git": true,
          "gh": true,
          "sessions": 250
        },
        "funkalization": {
          "git": true,
          "gh": true,
          "sessions": 6
        },
        "wild": {
          "git": true,
          "gh": true,
          "sessions": 62
        },
        "dulce-de-leche": {
          "git": true,
          "gh": true,
          "sessions": 32
        },
        "coffee": {
          "git": true,
          "gh": true,
          "sessions": 67
        }
      },
      "gh": {
        "wai": "cached",
        "testaruda": "cached",
        "turu": "cached",
        "dont": "cached",
        "ah": "cached",
        "pretender": "cached",
        "vampiro": "cached",
        "incitaciones": "cached",
        "bd": "missing",
        "openspec": "missing",
        "specodelic": "cached",
        "funkalization": "cached",
        "wild": "cached",
        "dulce-de-leche": "cached",
        "coffee": "cached"
      },
      "terapia": {
        "data": {
          "exit_nonzero": 7064,
          "edit_mismatch": 1566,
          "file_not_found": 1212,
          "network": 135,
          "other": 1881,
          "lang_runtime": 1339,
          "cli_flag_drift": 203
        },
        "provenance": "cached",
        "fetched_until": "2026-10-19T21:35:18+00:00"
      },
      "ah": {
        "wai": "cached",
        "testaruda": "cached",
        "turu": "cached",
        "dont": "cached",
        "ah": "cached",
        "pretender": "cached",
        "vampiro": "cached",
        "incitaciones": "cached",
        "bd": "missing",
        "openspec": "cached",
        "specodelic": "cached",
        "funkalization": "cached",
        "wild": "cached",
        "dulce-de-leche": "cached",
        "coffee": "cached"
      },
      "sessions_bias": "sessions cuenta s\u00f3lo sesiones pi (las otras fuentes no exponen cwd por sesi\u00f3n; coffe-i31)"
    },
    "clamped_negative_latencies": 207
  },
  "repos": [
    {
      "repo": "wai",
      "is_control": true,
      "is_outlier": false,
      "adoption": {
        "first_ddl_commit": null,
        "tools_first_use": {
          "wai": "2026-04-18T19:46:58.812Z",
          "testaruda": "2026-07-28T14:24:30.024Z",
          "turu": "2026-09-17T14:49:36.522Z",
          "dont": "2026-07-28T14:37:02.736Z",
          "ah": "2026-07-28T01:42:23.108Z",
          "pretender": "2026-07-28T14:39:58.044Z",
          "vampiro": null,
          "incitaciones": null,
          "bd": "2026-04-18T19:46:58.812Z",
          "openspec": "2026-04-18T20:14:31.531Z",
          "specodelic": null,
          "funkalization": null,
          "wild": null
        },
        "provenance": {
          "first_ddl_commit": "missing",
          "tools_first_use": "reported"
        }
      },
      "dose": 0.6153846153846154,
      "dose_detail": {
        "present": [
          "ah",
          "bd",
          "dont",
          "openspec",
          "pretender",
          "testaruda",
          "turu",
          "wai"
        ],
        "healthy": [],
        "missing": [
          "vampiro",
          "incitaciones",
          "specodelic",
          "funkalization",
          "wild"
        ]
      },
      "dose_provenance": "derived"
    },
    {
      "repo": "testaruda",
      "is_control": true,
      "is_outlier": false,
      "adoption": {
        "first_ddl_commit": null,
        "tools_first_use": {
          "wai": "2026-07-08T22:31:09.556Z",
          "testaruda": "2026-07-14T20:41:14.635Z",
          "turu": "2026-09-29T16:20:46.693Z",
          "dont": "2026-07-21T18:58:42.877Z",
          "ah": "2026-07-07T17:52:32.143Z",
          "pretender": "2026-07-07T17:52:38.628Z",
          "vampiro": null,
          "incitaciones": null,
          "bd": "2026-07-08T22:30:15.958Z",
          "openspec": "2026-07-08T22:32:44.077Z",
          "specodelic": null,
          "funkalization": null,
          "wild": null
        },
        "provenance": {
          "first_ddl_commit": "missing",
          "tools_first_use": "reported"
        }
      },
      "dose": 0.6153846153846154,
      "dose_detail": {
        "present": [
          "ah",
          "bd",
          "dont",
          "openspec",
          "pretender",
          "testaruda",
          "turu",
          "wai"
        ],
        "healthy": [],
        "missing": [
          "vampiro",
          "incitaciones",
          "specodelic",
          "funkalization",
          "wild"
        ]
      },
      "dose_provenance": "derived"
    },
    {
      "repo": "turu",
      "is_control": false,
      "is_outlier": false,
      "adoption": {
        "first_ddl_commit": "2026-10-14T09:30:30-03:00",
        "tools_first_use": {
          "wai": "2026-10-04T14:41:55.164Z",
          "testaruda": null,
          "turu": "2026-09-17T15:37:11.839Z",
          "dont": null,
          "ah": "2026-10-15T13:41:29.114Z",
          "pretender": "2026-10-04T17:39:19.603Z",
          "vampiro": null,
          "incitaciones": "2026-09-05T19:09:26.629Z",
          "bd": "2026-09-05T18:40:58.045Z",
          "openspec": "2026-09-15T19:27:39.576Z",
          "specodelic": null,
          "funkalization": null,
          "wild": null
        },
        "provenance": {
          "first_ddl_commit": "reported",
          "tools_first_use": "reported"
        }
      },
      "dose": 0.9230769230769231,
      "dose_detail": {
        "present": [
          "wai",
          "testaruda",
          "turu",
          "dont",
          "ah",
          "pretender",
          "vampiro",
          "incitaciones",
          "bd",
          "openspec",
          "specodelic",
          "wild"
        ],
        "healthy": [
          "wai",
          "testaruda",
          "turu",
          "dont",
          "ah",
          "pretender",
          "vampiro",
          "incitaciones",
          "bd",
          "openspec",
          "specodelic",
          "wild"
        ],
        "missing": [
          "funkalization"
        ]
      },
      "dose_provenance": "reported"
    },
    {
      "repo": "dont",
      "is_control": false,
      "is_outlier": false,
      "adoption": {
        "first_ddl_commit": "2026-10-14T09:24:01-03:00",
        "tools_first_use": {
          "wai": "2026-04-20T21:30:05.813Z",
          "testaruda": "2026-09-15T23:43:42.245Z",
          "turu": "2026-10-14T17:32:28.550Z",
          "dont": "2026-04-20T21:30:05.813Z",
          "ah": "2026-07-28T01:58:44.005Z",
          "pretender": "2026-07-18T01:43:14.700Z",
          "vampiro": "2026-09-15T23:43:42.245Z",
          "incitaciones": null,
          "bd": "2026-04-20T21:37:21.123Z",
          "openspec": "2026-04-20T21:33:50.404Z",
          "specodelic": null,
          "funkalization": null,
          "wild": null
        },
        "provenance": {
          "first_ddl_commit": "reported",
          "tools_first_use": "reported"
        }
      },
      "dose": 0.9230769230769231,
      "dose_detail": {
        "present": [
          "wai",
          "testaruda",
          "turu",
          "dont",
          "ah",
          "pretender",
          "vampiro",
          "incitaciones",
          "bd",
          "openspec",
          "specodelic",
          "wild"
        ],
        "healthy": [
          "wai",
          "testaruda",
          "turu",
          "dont",
          "ah",
          "pretender",
          "vampiro",
          "incitaciones",
          "bd",
          "openspec",
          "specodelic",
          "wild"
        ],
        "missing": [
          "funkalization"
        ]
      },
      "dose_provenance": "reported"
    },
    {
      "repo": "ah",
      "is_control": true,
      "is_outlier": false,
      "adoption": {
        "first_ddl_commit": null,
        "tools_first_use": {
          "wai": "2026-05-12T21:56:06.061Z",
          "testaruda": "2026-10-09T15:23:25.993Z",
          "turu": "2026-09-29T18:20:29.305Z",
          "dont": "2026-05-12T21:56:06.061Z",
          "ah": "2026-05-21T16:58:59.520Z",
          "pretender": "2026-09-30T18:20:14.148Z",
          "vampiro": null,
          "incitaciones": null,
          "bd": "2026-05-12T21:55:36.613Z",
          "openspec": "2026-05-12T21:56:06.061Z",
          "specodelic": "2026-09-29T19:23:04.615Z",
          "funkalization": null,
          "wild": null
        },
        "provenance": {
          "first_ddl_commit": "missing",